{
  "schema_version": 2,
  "catalog_version": "2026-10-07",
  "statuses": {
    "pass": "Implementation and evidence satisfy every acceptance criterion.",
    "partial": "Some acceptance criteria are met or verified; the finding names the gap.",
    "fail": "A known implementation gap violates the requirement.",
    "not_tested": "Applicable, but no evidence has been collected yet.",
    "accepted_risk": "Known gap explicitly accepted by a named owner with a rationale.",
    "not_applicable": "The app profile makes the control irrelevant.",
    "needs_review": "Applicability depends on an unknown capability in the app profile."
  },
  "severities": {
    "P0": "Public-release blocker: cross-tenant exposure, auth bypass, code execution, major AI/cost abuse, sensitive or child-data compromise.",
    "P1": "High-priority hardening required for public production.",
    "P2": "Medium risk or defense in depth.",
    "P3": "Low-risk improvement."
  },
  "owner_roles": {
    "Engineering": "Application code, tests and migrations.",
    "Platform/Ops": "Hosting, provider dashboards, CI and accounts.",
    "Security": "Threat modeling, release gating and incident process.",
    "Legal/Privacy": "Counsel decisions, notices, contracts and data-protection obligations.",
    "Product": "Audience, policy and user-experience decisions."
  },
  "efforts": {
    "S": "About a day or less.",
    "M": "Two to five days.",
    "L": "More than a week or cross-team."
  },
  "platforms": [
    "supabase",
    "vercel",
    "nextjs",
    "openai",
    "stripe"
  ],
  "features": [
    {
      "key": "web",
      "question": "Is any part of the product delivered in a browser (web app, PWA, marketing site with forms)?",
      "meaning": "Browser-delivered application surface."
    },
    {
      "key": "api",
      "question": "Does the product expose network endpoints (REST/GraphQL/RPC, server routes, server actions)?",
      "meaning": "Network API or server route surface."
    },
    {
      "key": "authentication",
      "question": "Do users or services sign in or present credentials?",
      "meaning": "User or service identity is required."
    },
    {
      "key": "oauth",
      "question": "Can users sign in with Google, Apple, Microsoft or another OAuth/OIDC provider?",
      "meaning": "Social or third-party OAuth/OIDC login."
    },
    {
      "key": "public_signup",
      "question": "Can anyone on the internet create an account (including guest or anonymous accounts) without an invitation?",
      "meaning": "Self-service or anonymous account creation open to the public."
    },
    {
      "key": "multi_tenant",
      "question": "Does data belong to different users, teams, organizations or clients that must not see each other's data?",
      "meaning": "Data partitioned by owner/tenant."
    },
    {
      "key": "file_uploads",
      "question": "Can users or external systems upload files?",
      "meaning": "Inbound files of any type."
    },
    {
      "key": "cloud_storage",
      "question": "Is user or business data stored in managed databases or object storage?",
      "meaning": "Managed/cloud persistence of user or business data."
    },
    {
      "key": "ai",
      "question": "Does the product call ML, LLM, vision, speech or generative models?",
      "meaning": "Application invokes models."
    },
    {
      "key": "external_ai_provider",
      "question": "Does any AI request send data to a provider outside your own infrastructure (OpenAI, Anthropic, Google, a gateway)?",
      "meaning": "AI request data leaves the application's trust boundary."
    },
    {
      "key": "rag",
      "question": "Does the product retrieve documents or records and place them into model context?",
      "meaning": "Retrieval-augmented generation."
    },
    {
      "key": "vector_store",
      "question": "Are embeddings of user or business data stored in a vector index?",
      "meaning": "Vector/embedding storage."
    },
    {
      "key": "ai_tools_or_agents",
      "question": "Can a model call tools, APIs, browsers or code, or change data, on its own?",
      "meaning": "Model-initiated actions."
    },
    {
      "key": "expensive_compute",
      "question": "Can a single request cost real money or quota (model calls, OCR, transcoding, GPU, paid APIs)?",
      "meaning": "Operations that materially consume money/compute/quota."
    },
    {
      "key": "outbound_fetch",
      "question": "Does the server fetch URLs or call hosts that a user, document or model can influence?",
      "meaning": "Server-side requests to user-influenced destinations."
    },
    {
      "key": "webhooks",
      "question": "Does the product receive inbound webhooks or callbacks from other services?",
      "meaning": "Inbound webhook/callback endpoints."
    },
    {
      "key": "user_generated_content",
      "question": "Can users publish content that other users see (posts, comments, shared pages, profiles)?",
      "meaning": "Content authored by one user and shown to others."
    },
    {
      "key": "sensitive_data",
      "question": "Does the product handle personal, confidential, regulated, financial, health, student, client or proprietary data?",
      "meaning": "Private or regulated data."
    },
    {
      "key": "minors",
      "question": "Could users or data subjects be under 18 (or under 13 for COPPA)?",
      "meaning": "Minors as users or data subjects."
    },
    {
      "key": "payments",
      "question": "Does the product accept payments or handle payment data?",
      "meaning": "Payment processing."
    },
    {
      "key": "admin_console",
      "question": "Is there a privileged operator, admin or support interface?",
      "meaning": "Privileged operator surface."
    },
    {
      "key": "third_party_integrations",
      "question": "Does the product connect to external SaaS or provider APIs on a user's behalf?",
      "meaning": "External integrations."
    },
    {
      "key": "auxiliary_services",
      "question": "Are there separate workers, microservices, local services, queue consumers or retrieval servers?",
      "meaning": "Components outside the main app process."
    }
  ],
  "controls": [
    {
      "id": "GMS-GOV-001",
      "domain": "Governance",
      "title": "Architecture and trust boundaries documented",
      "frameworks": [
        "OWASP ASVS 5.0",
        "NIST SSDF",
        "NIST AI RMF"
      ],
      "standard_refs": [
        "NIST SSDF PO.1",
        "NIST AI RMF MAP 1",
        "OWASP Top 10:2021 A04"
      ],
      "applies_when_any": [
        "all"
      ],
      "severity": "P1",
      "release_blocker": false,
      "owner_role": "Security",
      "effort": "M",
      "requirement": "Document trust boundaries, sensitive data flows, privileged components, external providers and production attack surfaces.",
      "acceptance_criteria": [
        "A current diagram/inventory lists every runtime component, data store, external provider and trust boundary.",
        "Each sensitive data flow names its source, destination and protection.",
        "The inventory was reviewed after the last material architecture change."
      ],
      "test_method": "Review current architecture/data-flow documentation against deployed components.",
      "verification_steps": [
        "Compare the inventory with deployed services, environment variables and provider dashboards.",
        "Trace one sensitive record from intake to deletion and confirm every hop is documented."
      ],
      "evidence_expected": "Current data-flow/trust-boundary diagram and component inventory.",
      "remediation_guidance": "Write a one-page data-flow/trust-boundary map and add it to the release checklist so it changes with the architecture.",
      "platform_guidance": {}
    },
    {
      "id": "GMS-GOV-002",
      "domain": "Governance",
      "title": "Sensitive data classification and lifecycle",
      "frameworks": [
        "OWASP ASVS 5.0",
        "NIST AI RMF"
      ],
      "standard_refs": [
        "NIST AI 600-1: Data Privacy",
        "GDPR Art. 5(1)(c),(e)",
        "COPPA 16 CFR 312.10"
      ],
      "applies_when_any": [
        "sensitive_data",
        "minors"
      ],
      "severity": "P0",
      "release_blocker": true,
      "owner_role": "Legal/Privacy",
      "effort": "M",
      "requirement": "Classify sensitive data and define collection, access, provider sharing, retention, deletion, logging and export rules.",
      "acceptance_criteria": [
        "Every stored data category has a classification, purpose, retention period and deletion mechanism.",
        "Data sent to each external provider is listed with its retention terms.",
        "Retention periods are enforced by code or scheduled jobs, not policy text alone."
      ],
      "test_method": "Trace representative records from collection through deletion and backups/providers.",
      "verification_steps": [
        "List tables, buckets, indexes, logs and provider copies; check each against the classification register.",
        "Confirm a scheduled job or trigger enforces each retention period."
      ],
      "evidence_expected": "Data inventory, retention/deletion tests, vendor flow documentation.",
      "remediation_guidance": "Create a data register (category, location, purpose, retention, deletion path, providers) and implement retention jobs for anything without one.",
      "platform_guidance": {}
    },
    {
      "id": "GMS-GOV-003",
      "domain": "Governance",
      "title": "Security release gate",
      "frameworks": [
        "NIST SSDF",
        "OWASP ASVS 5.0"
      ],
      "standard_refs": [
        "NIST SSDF PO.4",
        "NIST SSDF PW.8"
      ],
      "applies_when_any": [
        "all"
      ],
      "severity": "P1",
      "release_blocker": false,
      "owner_role": "Security",
      "effort": "S",